{
  "feature_id": "FEAT-69-long-file-check-state-package",
  "branch": "feat/FEAT-69-long-file-check-state-package",
  "pr": null,
  "review_sha": "none",
  "cycles_used": 0,
  "max_total_cycles": 10,
  "runs": [
    {
      "id": "plan-product",
      "squad": "product",
      "agent": "harness-product-lead",
      "verdict": "PASS",
      "started_at": "2026-09-28T19:24:43+00:00",
      "tokens": 186136,
      "ended_at": "2026-09-28T19:58:12+00:00",
      "cycles_used": 0,
      "code_grade": "n_a"
    }
  ],
  "judgements": [
    {
      "at": "2026-09-28T19:24:26+00:00",
      "by": "harness-orchestrator",
      "kind": "mission",
      "decision": "plan",
      "reason": "cause known and diff bounded, but a new importable surface (the package) and an enforcement change (the lock in check-plan-routes.py) \u2014 third test of the patch rule fails."
    },
    {
      "at": "2026-09-28T20:31:47.196363+00:00",
      "by": "harness-orchestrator",
      "kind": "amendment",
      "decision": "T-03.files",
      "reason": "INV-27's coupled-reader row for the features-path join moves with the join into check_state/ctx.py (layout_migration's own precedent); its fixture row moves with it. Found by the first full-table diff against the baseline."
    }
  ],
  "mission": "plan",
  "rework": {
    "rounds": 2,
    "wall_clock_minutes": 480,
    "decision": ".harness/harness/features/FEAT-69-long-file-check-state-package/notes/rework-ruling-2026-09-28.md"
  },
  "signed_task_hashes": {
    "T-01": "a2a256fac137c81aa446d24797491b51800c82292557f3c64a4749a116b7c64e",
    "T-02": "e23e251643c15e7ee022dcbe5ce903fe345e860e934d7003bcedd2f4b76821b4",
    "T-03": "771c4e5546361054f9970d7ba962ae1b81ded099f84b800f7444ac37a444551e",
    "T-04": "3dfca63ca78cf31c0c0f587b84d96ade5b0ce01291004c142d872d01bc57b6a4"
  },
  "github": {
    "milestone": 92,
    "parent": 1971,
    "attached": [
      "T-01",
      "T-02",
      "T-03",
      "T-04"
    ],
    "issues": {
      "T-01": 1972,
      "T-02": 1973,
      "T-03": 1974,
      "T-04": 1975
    },
    "source_issues": [],
    "build_entry": "opened"
  }
}
