{
  "feature_id": "BUG-1306-agent-type-hermetic-tests",
  "branch": "feat/BUG-1306-agent-type-hermetic-tests",
  "pr": null,
  "review_sha": "none",
  "cycles_used": 1,
  "max_total_cycles": 8,
  "runs": [
    {
      "id": "2026-09-05-02-validator",
      "squad": "validator",
      "agent": "harness-validator-lead",
      "verdict": "PASS",
      "code_grade": "n_a"
    },
    {
      "id": "2026-09-05-03-product",
      "squad": "product",
      "agent": "harness-product-lead",
      "verdict": "PASS"
    },
    {
      "id": "2026-09-05-04-product",
      "squad": "product",
      "agent": "harness-product-lead",
      "verdict": "PASS"
    },
    {
      "id": "2026-09-05-06-validator",
      "squad": "validator",
      "agent": "harness-validator-lead",
      "verdict": "FAIL",
      "code_grade": "n_a"
    }
  ]
}
