{
  "feature_id": "FEAT-51-claude-code-lifecycle-safety",
  "branch": "feat/FEAT-51-claude-code-lifecycle-safety",
  "pr": null,
  "review_sha": "none",
  "cycles_used": 9,
  "max_total_cycles": 20,
  "runs": [
    {
      "id": "plan-product",
      "squad": "product",
      "agent": "harness-product-lead",
      "verdict": "PASS"
    },
    {
      "id": "plan-fix-c1-product",
      "squad": "product",
      "agent": "harness-product-lead",
      "verdict": "ESCALATE"
    },
    {
      "id": "plan-fix-c2-product",
      "squad": "product",
      "agent": "harness-product-lead",
      "verdict": "PASS"
    },
    {
      "id": "plan-goalcheck-product",
      "squad": "product",
      "agent": "harness-product-lead",
      "verdict": "PASS"
    },
    {
      "id": "plan-fix-c3-product",
      "squad": "product",
      "agent": "harness-product-lead",
      "verdict": "PASS"
    },
    {
      "id": "plan-fix-c4-product",
      "squad": "product",
      "agent": "harness-product-lead",
      "verdict": "PASS"
    },
    {
      "id": "plan-panel-validator",
      "squad": "validator",
      "agent": "harness-validator-lead",
      "verdict": "FAIL",
      "code_grade": "n_a"
    },
    {
      "id": "plan-transcribe-product",
      "squad": "product",
      "agent": "harness-product-lead",
      "verdict": "PASS"
    },
    {
      "id": "plan-ruling-c6-product",
      "squad": "product",
      "agent": "harness-product-lead",
      "verdict": "PASS"
    },
    {
      "id": "plan-ruling-c7-product",
      "squad": "product",
      "agent": "harness-product-lead",
      "verdict": "PASS"
    },
    {
      "id": "plan-decnum-c8-product",
      "squad": "product",
      "agent": "harness-product-lead",
      "verdict": "PASS"
    },
    {
      "id": "plan-panel-c9-validator",
      "squad": "validator",
      "agent": "harness-validator-lead",
      "verdict": "FAIL",
      "code_grade": "n_a"
    },
    {
      "id": "plan-panelfix-c9-product",
      "squad": "product",
      "agent": "harness-product-lead",
      "verdict": "PASS"
    },
    {
      "id": "plan-panelverify-c9-validator",
      "squad": "validator",
      "agent": "harness-validator-lead",
      "verdict": "FAIL",
      "code_grade": "n_a"
    }
  ],
  "github": {
    "source_issues": [
      280,
      551
    ]
  }
}
