{
  "feature_id": "BUG-1016-worktree-relative-paths",
  "branch": "feat/BUG-1016-worktree-relative-paths",
  "pr": null,
  "review_sha": "none",
  "cycles_used": 1,
  "max_total_cycles": 10,
  "runs": [
    {
      "id": "plan-product",
      "squad": "product",
      "agent": "harness-product-lead",
      "verdict": "PASS",
      "started_at": "2026-10-04T14:48:46+00:00",
      "tokens": 110238,
      "ended_at": "2026-10-04T15:24:13+00:00",
      "cycles_used": 0,
      "code_grade": "n_a"
    },
    {
      "id": "plan-simplify-eng",
      "squad": "eng",
      "agent": "harness-eng-lead",
      "verdict": "PASS",
      "started_at": "2026-10-04T15:24:26+00:00",
      "tokens": 67327,
      "ended_at": "2026-10-04T15:32:27+00:00",
      "cycles_used": 0,
      "code_grade": "n_a"
    },
    {
      "id": "plan-apply-product",
      "squad": "product",
      "agent": "harness-product-lead",
      "verdict": "PASS",
      "started_at": "2026-10-04T15:32:29+00:00",
      "tokens": 48663,
      "ended_at": "2026-10-04T15:43:40+00:00",
      "cycles_used": 0,
      "code_grade": "n_a"
    },
    {
      "id": "t02-docs-eng",
      "squad": "eng",
      "agent": "harness-eng-lead",
      "verdict": "BLOCKED",
      "started_at": "2026-10-04T15:57:01+00:00",
      "ended_at": "2026-10-04T15:57:39+00:00",
      "cycles_used": 0,
      "tokens": null,
      "code_grade": "n_a"
    },
    {
      "id": "t02-docs-product",
      "squad": "product",
      "agent": "harness-product-lead",
      "verdict": "PASS",
      "started_at": "2026-10-04T15:57:43+00:00",
      "tokens": 56889,
      "ended_at": "2026-10-04T16:10:37+00:00",
      "cycles_used": 0
    },
    {
      "id": "build-simplify-eng",
      "squad": "eng",
      "agent": "harness-eng-lead",
      "verdict": "FAIL",
      "started_at": "2026-10-04T16:11:01+00:00",
      "tokens": 73646,
      "ended_at": "2026-10-04T16:22:05+00:00",
      "cycles_used": 1
    }
  ],
  "judgements": [
    {
      "at": "2026-10-04T14:48:44+00:00",
      "by": "harness-orchestrator",
      "kind": "mission",
      "decision": "plan",
      "reason": "grilling: cause known, but the fix adds a new enforcement-adapter behaviour (hook rewrites tool input across six tool shapes incl. edit hashline headers); new DEC expected; DEC-174 main-session-direct"
    },
    {
      "at": "2026-10-04T15:57:01+00:00",
      "by": "harness-orchestrator",
      "kind": "succession",
      "decision": "continue",
      "reason": "plan\u2192build seam at seq-3; T-01 landed main-session-direct (10f38a42); spend 0 cycles, within ruling; continue with T-02 docs"
    },
    {
      "at": "2026-10-04T15:57:41+00:00",
      "by": "harness-orchestrator",
      "kind": "continue",
      "decision": "continue",
      "reason": "t02-docs-eng opened against the wrong squad (documentor is product, build.yaml cannot reach it) and closed BLOCKED undispatched at 0 cycles; reopening as t02-docs-product"
    },
    {
      "at": "2026-10-04T16:21:49+00:00",
      "by": "harness-orchestrator",
      "kind": "continue",
      "decision": "continue",
      "reason": "simplify FAIL is a false premise: the only delta was feature.json run-start + host token stamp; 8/8 angles PASS, no applies; F1 flag-only (DEC-174 file) relayed to main session; proceed to seam"
    }
  ],
  "mission": "plan",
  "rework": {
    "rounds": 2,
    "wall_clock_minutes": 90,
    "decision": ".harness/harness/features/BUG-1016-worktree-relative-paths/notes/rework-ruling-2026-10-04.md"
  },
  "signed_task_hashes": {
    "T-01": "1aa77f6e73a124388b6e978622b07946c17f862deb4a4265ddd5c49ddef630be",
    "T-02": "8c66d08720d7091fa1a34f96929748f267e5a29b874f46651e55aeb30d4b453a"
  },
  "github": {
    "milestone": 96,
    "parent": 2016,
    "attached": [
      "T-01",
      "T-02"
    ],
    "issues": {
      "T-01": 2017,
      "T-02": 2018
    },
    "source_issues": [
      1016,
      1570
    ],
    "build_entry": "opened"
  }
}
