{
  "feature_id": "BUG-124-run-dir-squad-suffix",
  "branch": "feat/BUG-124-run-dir-squad-suffix",
  "pr": null,
  "review_sha": "none",
  "cycles_used": 7,
  "max_total_cycles": 10,
  "runs": [
    {
      "id": "plan-draft-product",
      "squad": "product",
      "agent": "harness-product-lead",
      "verdict": "PASS"
    },
    {
      "id": "goalcheck-plan-product",
      "squad": "product",
      "agent": "harness-product-lead",
      "verdict": "PASS"
    },
    {
      "id": "planpanel-validator",
      "squad": "validator",
      "agent": "harness-validator-lead",
      "verdict": "FAIL",
      "code_grade": "n_a"
    },
    {
      "id": "panel-record-product",
      "squad": "product",
      "agent": "harness-product-lead",
      "verdict": "PASS"
    },
    {
      "id": "replan-c1-product",
      "squad": "product",
      "agent": "harness-product-lead",
      "verdict": "PASS"
    },
    {
      "id": "planpanel-c1-validator",
      "squad": "validator",
      "agent": "harness-validator-lead",
      "verdict": "PASS",
      "code_grade": "n_a"
    },
    {
      "id": "panel-record-c1-product",
      "squad": "product",
      "agent": "harness-product-lead",
      "verdict": "PASS"
    },
    {
      "id": "2026-09-07-1-eng",
      "squad": "eng",
      "agent": "harness-eng-lead",
      "verdict": "PASS"
    },
    {
      "id": "2026-09-07-2-validator",
      "squad": "validator",
      "agent": "harness-validator-lead",
      "verdict": "FAIL"
    },
    {
      "id": "2026-09-07-3-validator",
      "squad": "validator",
      "agent": "harness-validator-lead",
      "verdict": "FAIL"
    },
    {
      "id": "2026-09-07-02-eng",
      "squad": "eng",
      "agent": "harness-eng-lead",
      "verdict": "PASS"
    },
    {
      "id": "2026-09-07-3-eng",
      "squad": "eng",
      "agent": "harness-eng-lead",
      "verdict": "PASS"
    },
    {
      "id": "2026-09-07-4-validator",
      "squad": "validator",
      "agent": "harness-validator-lead",
      "verdict": "PASS"
    },
    {
      "id": "2026-09-08-1-eng",
      "squad": "eng",
      "agent": "harness-eng-lead",
      "verdict": "PASS"
    }
  ]
}
