{
  "feature_id": "BUG-1699-lifecycle-cards",
  "branch": "feat/BUG-1699-lifecycle-cards",
  "pr": null,
  "review_sha": "none",
  "cycles_used": 2,
  "max_total_cycles": 10,
  "runs": [
    {
      "id": "2026-09-15-01-plan-product",
      "squad": "product",
      "agent": "harness-product-lead",
      "verdict": "PASS",
      "started_at": "2026-09-16T03:32:47+00:00",
      "ended_at": "2026-09-16T05:09:52+00:00",
      "tokens": null,
      "code_grade": "n_a",
      "cycles_used": 1
    },
    {
      "id": "2026-09-16-02-build-eng",
      "squad": "eng",
      "agent": "harness-eng-lead",
      "verdict": "PASS",
      "started_at": "2026-09-16T12:22:59+00:00",
      "ended_at": "2026-09-16T12:41:06+00:00",
      "cycles_used": 0,
      "tokens": null
    },
    {
      "id": "2026-09-16-03-build-eng",
      "squad": "eng",
      "agent": "harness-eng-lead",
      "verdict": "PASS",
      "started_at": "2026-09-16T12:42:18+00:00",
      "ended_at": "2026-09-16T12:51:42+00:00",
      "cycles_used": 1,
      "tokens": null
    },
    {
      "id": "2026-09-16-04-build-product",
      "squad": "product",
      "agent": "harness-product-lead",
      "verdict": "PASS",
      "started_at": "2026-09-16T13:20:32+00:00",
      "ended_at": "2026-09-16T13:31:21+00:00",
      "cycles_used": 0,
      "tokens": null
    },
    {
      "id": "2026-09-16-05-simplify-eng",
      "squad": "eng",
      "agent": "harness-eng-lead",
      "verdict": "BLOCKED",
      "started_at": "2026-09-16T13:32:09+00:00",
      "ended_at": "2026-09-16T13:54:53+00:00",
      "cycles_used": 0,
      "tokens": null,
      "code_grade": "n_a"
    },
    {
      "id": "2026-09-16-06-simplify-eng",
      "squad": "eng",
      "agent": "harness-eng-lead",
      "verdict": "PASS",
      "started_at": "2026-09-16T14:02:36+00:00",
      "ended_at": "2026-09-16T14:10:12+00:00",
      "cycles_used": 0,
      "tokens": null,
      "code_grade": "n_a"
    }
  ],
  "judgements": [
    {
      "at": "2026-09-16T03:32:47+00:00",
      "by": "harness-orchestrator",
      "kind": "mission",
      "decision": "plan",
      "reason": "The change rewrites the public lifecycle contract across signature, build, validation, rework, amendment, ship, and one-time reconciliation."
    },
    {
      "at": "2026-09-16T12:22:53+00:00",
      "by": "harness-orchestrator",
      "kind": "succession",
      "decision": "continue",
      "reason": "Approved plan is ready; continue into the signed build sequence."
    },
    {
      "at": "2026-09-16T12:40:59.303279+00:00",
      "by": "harness-orchestrator",
      "kind": "amendment",
      "decision": "T-01.files",
      "reason": "The signed intent requires INV-26 to consume project and start-task regression to stay green; both omitted sites needed same-task edits without changing any SC, task, or decision."
    },
    {
      "at": "2026-09-16T14:02:36+00:00",
      "by": "harness-orchestrator",
      "kind": "succession",
      "decision": "continue",
      "reason": "Main authorized the narrow read-only digest-contract repair; resume the mandatory simplify pass in a new successor run."
    }
  ],
  "mission": "plan",
  "rework": {
    "rounds": 2,
    "wall_clock_minutes": 90,
    "decision": ".harness/harness/features/BUG-1699-lifecycle-cards/notes/answers-plan-approval-2026-09-16.md"
  },
  "github": {
    "milestone": 77,
    "parent": 1763,
    "attached": [
      "T-01",
      "T-02",
      "T-03",
      "T-04",
      "T-05"
    ],
    "issues": {
      "T-01": 1764,
      "T-02": 1765,
      "T-03": 1766,
      "T-04": 1767,
      "T-05": 1768
    },
    "source_issues": [
      1699
    ],
    "build_entry": "opened"
  }
}
