{
  "feature_id": "BUG-201-depends-on-integrity",
  "branch": "feat/BUG-201-depends-on-integrity",
  "pr": null,
  "review_sha": "none",
  "cycles_used": 2,
  "max_total_cycles": 10,
  "runs": [
    {
      "id": "2026-09-06-01-product",
      "squad": "product",
      "verdict": "PASS",
      "agent": "harness-product-lead"
    },
    {
      "id": "2026-09-06-01-validator",
      "squad": "validator",
      "verdict": "PASS",
      "agent": "harness-validator-lead",
      "code_grade": "n_a"
    },
    {
      "id": "2026-09-06-02-product",
      "squad": "product",
      "verdict": "PASS",
      "agent": "harness-product-lead"
    },
    {
      "id": "2026-09-07-01-product",
      "squad": "product",
      "verdict": "BLOCKED",
      "agent": "harness-product-lead"
    },
    {
      "id": "2026-09-07-01-validator",
      "squad": "validator",
      "verdict": "PASS",
      "agent": "harness-validator-lead",
      "code_grade": "n_a"
    },
    {
      "id": "2026-09-07-02-product",
      "squad": "product",
      "verdict": "PASS",
      "agent": "harness-product-lead"
    },
    {
      "id": "2026-09-07-02-validator",
      "squad": "validator",
      "verdict": "PASS",
      "agent": "harness-validator-lead",
      "code_grade": "n_a"
    },
    {
      "id": "2026-09-07-03-product",
      "squad": "product",
      "verdict": "PASS",
      "agent": "harness-product-lead"
    },
    {
      "id": "2026-09-07-03-validator",
      "squad": "validator",
      "verdict": "PASS",
      "agent": "harness-validator-lead",
      "code_grade": "n_a"
    },
    {
      "id": "2026-09-07-01-eng",
      "squad": "eng",
      "verdict": "ESCALATE",
      "agent": "harness-eng-lead"
    },
    {
      "id": "2026-09-07-04-validator",
      "squad": "validator",
      "verdict": "PASS",
      "agent": "harness-validator-lead",
      "code_grade": "n_a"
    }
  ]
}
