{
  "feature_id": "FEAT-67-complex-function-second-wave",
  "branch": "feat/FEAT-67-complex-function-second-wave",
  "pr": null,
  "review_sha": "none",
  "cycles_used": 0,
  "max_total_cycles": 10,
  "runs": [
    {
      "id": "patch-product",
      "squad": "product",
      "agent": "harness-product-lead",
      "verdict": "PASS",
      "started_at": "2026-09-27T14:12:36+00:00",
      "tokens": 84841,
      "ended_at": "2026-09-27T14:23:25+00:00",
      "cycles_used": 0,
      "code_grade": "n_a"
    },
    {
      "id": "build-main-direct",
      "squad": "eng",
      "agent": "main-session",
      "verdict": "PENDING",
      "started_at": "2026-09-27T14:38:24+00:00"
    }
  ],
  "judgements": [
    {
      "at": "2026-09-27T14:12:31+00:00",
      "by": "harness-orchestrator",
      "kind": "mission",
      "decision": "patch",
      "reason": "cause known (one body carrying every rule for its input), diff bounded to three named functions and their suites, with no new public interface, schema, or enforcement surface"
    },
    {
      "at": "2026-09-27T14:38:24+00:00",
      "by": "main-session",
      "kind": "succession",
      "decision": "continue",
      "reason": "DEC-174: T-01 is main-session-direct; the main session builds in the worktree"
    }
  ],
  "mission": "patch",
  "rework": {
    "rounds": 2,
    "wall_clock_minutes": 90,
    "decision": ".harness/harness/features/FEAT-67-complex-function-second-wave/BRIEF.md"
  },
  "signed_task_hashes": {
    "T-01": "59dc7a181d84fd6267f3ae92296045925ac04ed3aae948eb1bbfcdb59ca85e2c"
  },
  "github": {
    "milestone": 90,
    "parent": 1941,
    "attached": [
      "T-01"
    ],
    "issues": {
      "T-01": 1942
    },
    "source_issues": [],
    "build_entry": "opened"
  }
}
